{
  "id": "00032",
  "license": "CC0",
  "family": "rimpa",
  "style": {
    "traits": [
      "pattern_equals_form",
      "no_chiaroscuro",
      "gold_ground",
      "closed_outline"
    ],
    "palette": [
      "gold",
      "malachite",
      "azurite",
      "jade_white",
      "soot"
    ]
  },
  "theme": {
    "primary": "water",
    "secondary": []
  },
  "content": [
    "boat",
    "figure",
    "wave",
    "ridge",
    "spray",
    "cloud",
    "screen",
    "water"
  ],
  "composition": "full_page",
  "caption_en": "decomineral style, flat mineral pigments, no chiaroscuro, pattern equal to form, patterned water, gold ground, closed color shapes, a boat with figures on curling waves drawn as flat overlapping ridges of green and blue, spray repeated as combed ornament on a gold ground, pale cloud bands above, gold, malachite green, azurite blue, jade white, soot",
  "notes_zh": "《波に舟図屏風》(Met CC0, 49.35.3d)：金地卷浪+载人之舟，E 族 water。",
  "split": "train"
}