{
  "id": "00022",
  "license": "PD",
  "family": "persian_miniature",
  "style": {
    "traits": [
      "flat_fill",
      "mineral_pigment",
      "pattern_equals_form",
      "no_chiaroscuro",
      "closed_outline",
      "patterned_terrain"
    ],
    "palette": [
      "lapis",
      "malachite",
      "cinnabar",
      "gold",
      "jade_white"
    ]
  },
  "theme": {
    "primary": "water",
    "secondary": []
  },
  "content": [
    "swimmer",
    "pool",
    "lotus",
    "pavilion",
    "arch",
    "onlooker",
    "robe",
    "fish",
    "boat",
    "hill",
    "cypress"
  ],
  "composition": "central_figure",
  "caption_en": "decomineral style, flat mineral pigments, no chiaroscuro, pattern equal to form, closed color shapes, patterned water, mountains patterned as dense forest, a swimming figure in a lotus pool beneath a tiled pavilion where robed onlookers lean from an arch, fish and a small boat on the water, flower-dotted hills and a dark cypress behind, lapis blue, malachite green, cinnabar red, gold, jade white",
  "notes_zh": "《Khusraw 窥 Shirin 沐浴》：莲池中泳者，鱼与小舟，纹样山坡与柏树。",
  "split": "train"
}