{
  "id": "00036",
  "license": "PD",
  "family": "persian_miniature",
  "style": {
    "traits": [
      "flat_fill",
      "mineral_pigment",
      "pattern_equals_form",
      "no_chiaroscuro",
      "closed_outline",
      "tapestry_space"
    ],
    "palette": [
      "lapis",
      "cinnabar",
      "malachite",
      "gold",
      "jade_white"
    ]
  },
  "theme": {
    "primary": "court",
    "secondary": []
  },
  "content": [
    "king",
    "throne",
    "canopy",
    "courtier",
    "carpet",
    "vessel",
    "tent",
    "rock",
    "tree"
  ],
  "composition": "central_figure",
  "caption_en": "decomineral style, flat mineral pigments, no chiaroscuro, pattern equal to form, closed color shapes, tapestry space, a young king enthroned beneath a patterned tent canopy with courtiers standing in rows, a jewelled carpet and gold vessels before the throne, rocky slopes and stylized trees behind, lapis blue, cinnabar red, malachite green, gold, jade white",
  "notes_zh": "《Luhrasp 登基》(Commons PD, 伊朗17世纪)：宝座帐顶+廷臣列+宝石地毯。",
  "split": "train"
}